{
  "$schema": "http://json-schema.org/draft-07/schema#",
  "$id": "specs/experiment_plans/schema.json",
  "title": "ExperimentPlan",
  "description": "Closed ExperimentPlan v2. Exact strategy id/version/hash, governed FeatureRefs, strict enums, and execution disabled.",
  "$comment": "Exactly four typed plans live beside this schema. v1 is audit-only and is never execution eligible. fill_contract consts are locked to controlled_pilot_v1.generated.json.",
  "type": "object",
  "additionalProperties": false,
  "required": [
    "version",
    "plan_id",
    "idea_id",
    "hypothesis",
    "strategy_spec_id",
    "strategy_spec_version",
    "strategy_spec_hash",
    "feature_refs",
    "research_data_profile_id",
    "universe",
    "period_start",
    "period_end",
    "cost_scenario",
    "evaluation_protocol",
    "risk_policy",
    "budget_allocation",
    "execution_enabled",
    "identity",
    "fill_contract"
  ],
  "properties": {
    "version": {
      "type": "string",
      "const": "experiment-plan/v2"
    },
    "plan_id": {
      "type": "string",
      "minLength": 1
    },
    "idea_id": {
      "type": "string",
      "minLength": 1
    },
    "hypothesis": {
      "type": "string",
      "minLength": 1
    },
    "strategy_spec_id": {
      "type": "string",
      "minLength": 1
    },
    "strategy_spec_version": {
      "type": "string",
      "const": "strategy-spec/v3"
    },
    "strategy_spec_hash": {
      "type": "string",
      "pattern": "^sha256:[0-9a-f]{64}$"
    },
    "feature_refs": {
      "type": "array",
      "minItems": 1,
      "uniqueItems": true,
      "items": {
        "type": "object",
        "additionalProperties": false,
        "required": [
          "id",
          "version"
        ],
        "properties": {
          "id": {
            "type": "string",
            "minLength": 1
          },
          "version": {
            "type": "string",
            "minLength": 1
          },
          "params": {
            "type": "object"
          }
        }
      }
    },
    "research_data_profile_id": {
      "type": "string",
      "const": "core"
    },
    "universe": {
      "type": "array",
      "minItems": 1,
      "uniqueItems": true,
      "items": {
        "type": "string",
        "enum": [
          "tse_prime_with_fins"
        ]
      }
    },
    "period_start": {
      "type": "string",
      "pattern": "^[0-9]{4}-[0-9]{2}-[0-9]{2}$"
    },
    "period_end": {
      "type": "string",
      "pattern": "^[0-9]{4}-[0-9]{2}-[0-9]{2}$"
    },
    "cost_scenario": {
      "type": "string",
      "enum": [
        "default_one_way_10bp"
      ]
    },
    "evaluation_protocol": {
      "type": "string",
      "enum": [
        "standard_research_eval"
      ]
    },
    "risk_policy": {
      "type": "string",
      "enum": [
        "core_crash_high_vol"
      ]
    },
    "budget_allocation": {
      "type": "object",
      "minProperties": 1,
      "additionalProperties": false,
      "properties": {
        "generations": {
          "type": "integer",
          "minimum": 1
        },
        "model_calls": {
          "type": "integer",
          "minimum": 1
        },
        "input_tokens": {
          "type": "integer",
          "minimum": 1
        },
        "output_tokens": {
          "type": "integer",
          "minimum": 1
        },
        "cached_tokens": {
          "type": "integer",
          "minimum": 1
        },
        "paper_runs": {
          "type": "integer",
          "minimum": 1
        },
        "compute_time_ms": {
          "type": "integer",
          "minimum": 1
        },
        "estimated_cost_micros": {
          "type": "integer",
          "minimum": 1
        }
      }
    },
    "execution_enabled": {
      "type": "boolean",
      "const": false
    },
    "identity": {
      "type": "string",
      "const": "controlled_pilot_v1"
    },
    "fill_contract": {
      "type": "object",
      "additionalProperties": false,
      "required": [
        "format",
        "id",
        "version",
        "identity",
        "execution_mode",
        "signal_session",
        "signal_price_field",
        "signal_price_dataset",
        "fill_session",
        "fill_valuation_field",
        "fill_valuation_session",
        "information_cutoff",
        "lifecycle",
        "price_evidence_mode",
        "retrospective_only",
        "draft",
        "live_trading_evidence",
        "ready_snapshot_declared",
        "go",
        "automatic_promotion",
        "fallback",
        "forward_fill",
        "contract_digest"
      ],
      "properties": {
        "format": {
          "const": "controlled-pilot-fill-contract/v1"
        },
        "id": {
          "const": "controlled-pilot-am-signal-pm-close"
        },
        "version": {
          "const": "1.1.0"
        },
        "identity": {
          "const": "controlled_pilot_v1"
        },
        "execution_mode": {
          "const": "am_signal_pm_close"
        },
        "signal_session": {
          "const": "morning_close"
        },
        "signal_price_field": {
          "const": "MAdjC"
        },
        "signal_price_dataset": {
          "const": "equities_bars_daily"
        },
        "fill_session": {
          "const": "afternoon_close"
        },
        "fill_valuation_field": {
          "const": "AAdjC"
        },
        "fill_valuation_session": {
          "const": "same_trading_date"
        },
        "information_cutoff": {
          "const": "11:30:00+09:00"
        },
        "lifecycle": {
          "const": "Paper"
        },
        "retrospective_only": {
          "const": true
        },
        "draft": {
          "const": false
        },
        "live_trading_evidence": {
          "const": false
        },
        "ready_snapshot_declared": {
          "const": true
        },
        "go": {
          "const": false
        },
        "automatic_promotion": {
          "const": false
        },
        "fallback": {
          "const": false
        },
        "forward_fill": {
          "const": false
        },
        "contract_digest": {
          "const": "sha256:3691b4c93bbafc1d5a0e8fec25eb14ec26fae9683aaffa07fd44bb80c4f486b8"
        },
        "price_evidence_mode": {
          "const": "historical_daily_reconstruction"
        }
      }
    }
  }
}
