{
  "version": "experiment-plan/v2",
  "identity": "controlled_pilot_v1",
  "plan_id": "exp-fund-hold10-value-mom",
  "idea_id": "idea-fund-hold10-value-mom",
  "hypothesis": "Fundamentals value\u00d7momentum agree with hold=10 and momentum_n=10 (frozen KEEP pin, not retuned) is a 2-condition fund sleeve on TSE Prime with fins.",
  "strategy_spec_id": "fundamentals_hold_10",
  "strategy_spec_version": "strategy-spec/v3",
  "strategy_spec_hash": "sha256:355df8a97da76bcb988ca33c6a7dfcd4be0c1f598aa8f962b55c8c5872f84007",
  "feature_refs": [
    {
      "id": "retrospective_split_safe_fundamental_value_score",
      "version": "1.0.0",
      "params": {}
    },
    {
      "id": "retrospective_split_adjusted_momentum_n",
      "version": "1.0.0",
      "params": {
        "n": 10
      }
    }
  ],
  "research_data_profile_id": "core",
  "universe": [
    "tse_prime_with_fins"
  ],
  "period_start": "2023-01-04",
  "period_end": "2023-10-13",
  "cost_scenario": "default_one_way_10bp",
  "evaluation_protocol": "standard_research_eval",
  "risk_policy": "core_crash_high_vol",
  "budget_allocation": {
    "generations": 1
  },
  "execution_enabled": false,
  "fill_contract": {
    "format": "controlled-pilot-fill-contract/v1",
    "id": "controlled-pilot-am-signal-pm-close",
    "version": "1.1.0",
    "identity": "controlled_pilot_v1",
    "execution_mode": "am_signal_pm_close",
    "signal_session": "morning_close",
    "signal_price_field": "MAdjC",
    "signal_price_dataset": "equities_bars_daily",
    "fill_session": "afternoon_close",
    "fill_valuation_field": "AAdjC",
    "fill_valuation_session": "same_trading_date",
    "information_cutoff": "11:30:00+09:00",
    "lifecycle": "Paper",
    "price_evidence_mode": "historical_daily_reconstruction",
    "retrospective_only": true,
    "draft": false,
    "live_trading_evidence": false,
    "ready_snapshot_declared": true,
    "go": false,
    "automatic_promotion": false,
    "fallback": false,
    "forward_fill": false,
    "contract_digest": "sha256:3691b4c93bbafc1d5a0e8fec25eb14ec26fae9683aaffa07fd44bb80c4f486b8"
  }
}
